Titulo;Link;Data da postagem
Futebol feminino: Quarta-feira de coletivo e presença da Grazi no CT para as Brabas;https://www.corinthians.com.br/noticias/futebol-feminino-quarta-feira-de-coletivo-e-presenca-da-grazi-no-ct-para-as-brabas;17.01.2024 14:18
Fut. masc.: Timão bate São Caetano no último jogo-treino da pré-temporada 2024;https://www.corinthians.com.br/noticias/fut-masc-timao-bate-sao-caetano-no-ultimo-jogo-treino-da-pre-temporada-2024;17.01.2024 14:07
Timãozinho goleia o CRB por 6 a 0 e está nas quartas de final da Copinha 2024;https://www.corinthians.com.br/noticias/timaozinho-goleia-o-crb-por-6-a-0-e-esta-nas-quartas-de-final-da-copinha-2024;16.01.2024 20:34
Futebol Feminino: Corinthians contrata Robertinha para as categorias de base;https://www.corinthians.com.br/noticias/futebol-feminino-corinthians-contrata-robertinha-para-as-categorias-de-base;16.01.2024 19:00
Futebol masculino: Corinthians faz treino tático antes de mais um jogo-treino;https://www.corinthians.com.br/noticias/futebol-masculino-corinthians-faz-treino-tatico-antes-de-mais-um-jogo-treino;16.01.2024 17:50
Futebol feminino: terça-feira de trabalho defensivo e psicológico para as Brabas;https://www.corinthians.com.br/noticias/futebol-feminino-terca-feira-de-trabalho-defensivo-e-psicologico-para-as-brabas;16.01.2024 13:39
Corinthians informa: Sobre dispositivos de espionagem encontrados pela nova gestão;https://www.corinthians.com.br/noticias/corinthians-informa-sobre-dispositivos-de-espionagem-encontrados-pela-nova-gestao;15.01.2024 18:55
Fut. masc.: Corinthians faz último treino em dois períodos da pré-temporada 2024;https://www.corinthians.com.br/noticias/fut-masc-corinthians-faz-ultimo-treino-em-dois-periodos-da-pre-temporada-2024;15.01.2024 18:30
Corinthians renova empréstimo de Maycon;https://www.corinthians.com.br/noticias/corinthians-renova-emprestimo-de-maycon;15.01.2024 17:50
Gustavo Henrique é o novo zagueiro do Corinthians;https://www.corinthians.com.br/noticias/gustavo-henrique-e-o-novo-zagueiro-do-corinthians;15.01.2024 16:40